dataset_id,source_url,output_file,downloaded_at_utc,status,record_count,notes
eia_california_electricity_profile_snapshot,https://www.eia.gov/electricity/state/california/,data\raw\external-region-data\california\energy_prices\eia_california_electricity_profile_2024.html,2026-04-03T14:45:54+00:00,downloaded,21,Official California electricity profile HTML snapshot.
eia_california_electricity_profile_summary,https://www.eia.gov/electricity/state/california/,data\raw\external-region-data\california\energy_prices\eia_california_electricity_profile_summary_2024.csv,2026-04-03T14:45:54+00:00,generated,21,Structured summary table extracted from the California electricity profile page.
eia_california_natural_gas_history_snapshot,https://www.eia.gov/dnav/ng/hist/n3035ca3A.htm,data\raw\external-region-data\california\energy_prices\eia_california_natural_gas_industrial_price_history.html,2026-04-03T14:45:54+00:00,downloaded,29,Official California natural gas industrial price history HTML snapshot.
eia_california_natural_gas_history_xls,https://www.eia.gov/dnav/ng/hist_xls/N3035CA3a.xls,data\raw\external-region-data\california\energy_prices\eia_california_natural_gas_industrial_price_history.xls,2026-04-03T14:45:54+00:00,downloaded,29,Official California natural gas industrial price history XLS file.
eia_california_natural_gas_history_structured,https://www.eia.gov/dnav/ng/hist/n3035ca3A.htm,data\raw\external-region-data\california\energy_prices\eia_california_natural_gas_industrial_price_annual.csv,2026-04-03T14:45:54+00:00,generated,29,Structured annual California industrial natural gas price series extracted from EIA history page.
eia_california_energy_price_reference,https://www.eia.gov/electricity/state/california/,data\raw\external-region-data\california\energy_prices\california_energy_price_reference.csv,2026-04-03T14:45:54+00:00,generated,2,Combined California electricity and natural gas baseline price references aligned to 2024.
